[
  {
    "schema_version": 1,
    "fire_id": "fire-001",
    "trigger_id": "trg-001",
    "invocation_id": "inv-001",
    "organization_id": "org-support",
    "project_id": "prj-support",
    "agent_id": "agt-support",
    "agent_version": 2,
    "agent_version_snapshot": {
      "agent_id": "agt-support",
      "version": 2,
      "execution_mode": "worker",
      "model": {"response": {"tier": "balanced"}},
      "instructions": {"kind": "inline", "content": "Handle support requests."},
      "tools_snapshot": [{"tool_id": "tool-lookup-case", "version": "2026-07-15", "idempotency": "idempotent", "timeout_ms": 5000, "output_schema": {"type": "object"}, "expected_runtime_ms": 100, "name": "lookup_case", "description": "Look up a support case.", "parameters_schema": {"type": "object"}, "execution": {"locus": "worker"}}],
      "options": {"sticky_workers": false},
      "created_at": "2026-07-15T00:00:00Z",
      "created_by": "usr-001"
    },
    "payload": {"case_id": "case-1001"},
    "session_id": "ses-001",
    "root_event_id": "evt-001",
    "trigger_chain_depth": 0
  }
]
